ID,Name,Description,Category ID,Category Name,Price,Available,Image URL,Popular,Preparation Time,Name EN,Name AZ,Name RU,Name TR,Name AR,Name HI,Name FR,Name IT,Description EN,Description AZ,Description RU,Description TR,Description AR,Description HI,Description FR,Description IT,Created At,Updated At
cat-1-s-h-r-yem-yi-6-omlet,Omelet ,,cat-1-s-h-r-yem-yi,Breakfast,7.2,1,https://cdn.cafetap.az/storage/images/ybyVPQlhklet8w4PqXRF3EMEmngaPzcRDhdBYrRxgnEtAA8Rpt.jpeg,0,15,Omelet ,Omlet,Омлет,Omlet,عجة,आमलेट,Omelette,Frittata,Fluffy eggs cooked to perfection,Mükəmməllik üçün bişirilmiş tüklü yumurta,"Пышные яйца, приготовленные до совершенства",Mükemmel şekilde pişirilmiş kabarık yumurtalar,بيض رقيق مطبوخ إلى حد الكمال,पूरी तरह से पकाए गए मुलायम अंडे,Œufs moelleux cuits à la perfection,Uova soffici cotte alla perfezione,2025-05-08 14:33:57,2025-05-08 14:33:57
cat-1-s-h-r-yem-yi-1-organi-k-k-nd-s-h-r-yem-yi---iki-n-f-rlik-,Organic Village Breakfast (For Two) ,,cat-1-s-h-r-yem-yi,Breakfast,45,1,https://cdn.cafetap.az/storage/images/aUqodNvgs91vgHmfXhzw9v0KRzLVdnP8uFnp5reLeoLv1CBnGq.jpeg,0,15,Organic Village Breakfast (For Two) ,Orqanik Kənd Səhər Yeməyi (İki Nəfərlik),Органический деревенский завтрак (на двоих),Organik Köy Kahvaltısı (İki Kişilik),إفطار القرية العضوية (لشخصين),ऑर्गेनिक विलेज ब्रेकफास्ट (दो लोगों के लिए),Petit-déjeuner du village biologique (pour deux),Colazione biologica del villaggio (per due),Traditional breakfast spread for sharing,Paylaşmaq üçün ənənəvi səhər yeməyi,"Традиционный завтрак, который можно разделить",Paylaşmak için geleneksel kahvaltı sofrası,وجبة إفطار تقليدية للمشاركة,साझा करने के लिए पारंपरिक नाश्ता,Petit-déjeuner traditionnel à partager,Colazione tradizionale da condividere,2025-05-08 14:33:57,2025-05-08 14:33:57
cat-1-s-h-r-yem-yi-7-sucuklu-yumurta,Eggs With Sausage ,,cat-1-s-h-r-yem-yi,Breakfast,9.2,1,https://cdn.cafetap.az/storage/images/yrsiUvTHyxH7sQM9kBIjD7wjDJ02jxZvi7vSIDLOMrVBiKm6x1.jpeg,0,15,Eggs With Sausage ,Sucuqlu Yumurta,Яйца с колбасой,Sosisli Yumurta,بيض مع سجق,सॉसेज के साथ अंडे,Œufs à la saucisse,Uova con salsiccia,Farm eggs with grilled sausage,Qızardılmış kolbasa ilə ferma yumurtaları,Фермерские яйца с жареными колбасками,Izgara sosisli çiftlik yumurtaları,بيض المزرعة مع النقانق المشوية,ग्रिल्ड सॉसेज के साथ फार्म अंडे,Œufs de ferme avec saucisse grillée,Uova di fattoria con salsiccia alla griglia,2025-05-08 14:33:57,2025-05-08 14:33:57
cat-1-s-h-r-yem-yi-2-s-h-r-yem-yi-,Breakfast For One,,cat-1-s-h-r-yem-yi,Breakfast,22,1,https://cdn.cafetap.az/storage/images/IycA0z1yDMA6SFfSmnkxwhx8CvpWTngqKZJSZjXDF5A84hHvCK.jpeg,0,15,Breakfast For One,Bir Nəfərlik Səhər Yeməyi,Завтрак на одного,Bir Kişilik Kahvaltı,وجبة إفطار لشخص واحد,एक के लिए नाश्ता,Petit-déjeuner pour une personne,Colazione per uno,Complete breakfast meal for single diner,Tək nahar üçün tam səhər yeməyi,Полный завтрак для одного человека,Tek kişilik yemek yiyenler için tam kahvaltı menüsü,وجبة إفطار كاملة لشخص واحد,एकल भोजनकर्ता के लिए पूर्ण नाश्ता,Petit-déjeuner complet pour un dîner seul,Colazione completa per commensali singoli,2025-05-08 14:33:57,2025-05-08 14:33:57
cat-1-s-h-r-yem-yi-3-s-h-r-yem-yi-,Breakfast For Two,FOR TWO,cat-1-s-h-r-yem-yi,Breakfast,29.5,1,https://cdn.cafetap.az/storage/images/kWshoG5SSlYQrKgRWJOQ4vqs3EpP9jmooKSwaXX3MY8uJlNCsA.jpeg,0,15,Breakfast For Two,İki Nəfərlik Səhər Yeməyi,Завтрак на двоих,İki Kişilik Kahvaltı,وجبة إفطار لشخصين,दो लोगों के लिए नाश्ता,Petit-déjeuner pour deux,Colazione per due,Generous breakfast spread for two people,İki nəfərlik səxavətli səhər yeməyi,Щедрый завтрак на двоих,İki kişi için cömert kahvaltı büfesi,وجبة إفطار سخية لشخصين,दो लोगों के लिए भरपूर नाश्ता,Petit-déjeuner copieux pour deux personnes,Ricca colazione per due persone,2025-05-08 14:33:57,2025-05-08 14:33:57
cat-1-s-h-r-yem-yi-4-s-h-r-yem-yi-,Breakfast For Four,FOR FOUR,cat-1-s-h-r-yem-yi,Breakfast,42,1,https://cdn.cafetap.az/storage/images/3XdKeDgPmWT6KMtfyklxmz4TOXy76F0chnNmCX2LnY9Ws430Xa.jpeg,0,15,Breakfast For Four,Dörd Nəfərlik Səhər Yeməyi,Завтрак на четверых,Dört Kişilik Kahvaltı,إفطار لأربعة أشخاص,चार लोगों के लिए नाश्ता,Petit-déjeuner pour quatre,Colazione per quattro,Family-style breakfast platter,Ailə tərzi səhər yeməyi yeməyi,Завтрак в семейном стиле,Aile tarzı kahvaltı tabağı,طبق إفطار عائلي,पारिवारिक शैली का नाश्ता,Plateau de petit-déjeuner familial,Piatto per la colazione in stile familiare,2025-05-08 14:33:57,2025-05-08 14:33:57
cat-1-s-h-r-yem-yi-8-t-r-v-zli--yumurta,Vegetable Omelet ,,cat-1-s-h-r-yem-yi,Breakfast,9.9,1,https://cdn.cafetap.az/storage/images/LEzFSe1tYZhFlygkxMnLti4fUUUtkq4s2SbM05Xo8Xnbl0rBpv.jpeg,0,15,Vegetable Omelet ,Tərəvəzli Yumurta,Овощной омлет,Sebzeli Omlet,عجة الخضار,सब्जी ऑमलेट,Omelette aux légumes,Frittata di verdure,Fluffy omelet with fresh seasonal vegetables,Təzə mövsüm tərəvəzləri ilə tüklü omlet,Воздушный омлет со свежими сезонными овощами,Taze mevsim sebzeleriyle kabarık omlet,عجة رقيقة مع خضروات موسمية طازجة,ताजा मौसमी सब्जियों के साथ स्वादिष्ट ऑमलेट,Omelette moelleuse aux légumes frais de saison,Frittata soffice con verdure fresche di stagione,2025-05-08 14:33:57,2025-05-08 14:33:57
cat-1-s-h-r-yem-yi-5-i-ngi-li-s-s-h-r-yem-yi-,English Breakfast ,,cat-1-s-h-r-yem-yi,Breakfast,13,1,https://cdn.cafetap.az/storage/images/kMAD8aHaiYMTw2Op1UxH9dIsSeUEK3pjH3TlUXfYZJl75FBIz6.jpeg,0,15,English Breakfast ,İngilis Səhər Yeməyi,Английский завтрак,İngiliz Kahvaltısı,فطور إنجليزي,अंग्रेजी नाश्ता,Petit-déjeuner anglais,Colazione inglese,Full British breakfast with all traditional items,Bütün ənənəvi əşyalarla dolu Britaniya səhər yeməyi,Полный британский завтрак со всеми традиционными блюдами,Tüm geleneksel yiyeceklerin yer aldığı tam İngiliz kahvaltısı,وجبة إفطار بريطانية كاملة مع جميع العناصر التقليدية,सभी पारंपरिक व्यंजनों के साथ पूर्ण ब्रिटिश नाश्ता,Petit-déjeuner britannique complet avec tous les plats traditionnels,Colazione britannica completa con tutti gli elementi tradizionali,2025-05-08 14:33:57,2025-05-08 14:33:57
cat-11-toyuq-yem-kl-ri--2-faxi-tas-toyuq-i-l-,Chicken Fajitas ,,cat-11-toyuq-yem-kl-ri-,Chicken Dishes,18.5,1,/spinner.svg,0,15,Chicken Fajitas ,Toyuqlu Faxitas,Фахитас с курицей,Tavuk Fajitaları,فاهيتا الدجاج,चिकन फजितास,Fajitas au poulet,Fajitas di pollo,Sizzling chicken with peppers and tortillas,Bibər və tortilla ilə qızardılmış toyuq,Жареная курица с перцем и лепешками,Biber ve tortillalarla cızırtılı tavuk,دجاج ساخن مع الفلفل والتورتيلا,मिर्च और टॉर्टिला के साथ चटपटा चिकन,Poulet grésillant aux poivrons et tortillas,Pollo sfrigolante con peperoni e tortillas,2025-05-08 14:33:57,2025-05-08 14:33:57
cat-11-toyuq-yem-kl-ri--4-ki-yev-saya-i-kotlet,Chicken Kiev Cutlet ,,cat-11-toyuq-yem-kl-ri-,Chicken Dishes,18,1,/spinner.svg,0,15,Chicken Kiev Cutlet ,Kiev Sayağı Kotlet,Котлета по-киевски,Tavuk Kiev Pirzolası,شريحة دجاج كييف,चिकन कीव कटलेट,Escalope de poulet à la Kiev,Cotoletta di pollo alla Kiev,Breaded chicken breast with herb butter,Kərə yağı ilə bişmiş toyuq döşü,Куриная грудка в панировке с травяным маслом,Otlu tereyağlı ekmekli tavuk göğsü,صدر دجاج مقلي مع زبدة الأعشاب,हर्ब बटर के साथ ब्रेडेड चिकन ब्रेस्ट,Poitrine de poulet panée au beurre aux herbes,Petto di pollo impanato con burro alle erbe,2025-05-08 14:33:57,2025-05-08 14:33:57
cat-11-toyuq-yem-kl-ri--6-li-mon-souslu-toyuq,Lemon Sauce Chicken ,,cat-11-toyuq-yem-kl-ri-,Chicken Dishes,19,1,/spinner.svg,0,15,Lemon Sauce Chicken ,Limon Souslu Toyuq,Курица в лимонном соусе,Limon Soslu Tavuk,دجاج بصلصة الليمون,नींबू सॉस चिकन,Poulet à la sauce au citron,Pollo al limone,Grilled chicken with tangy lemon glaze,Qızardılmış toyuq ətli limon şirəsi ilə,Жареная курица с пикантной лимонной глазурью,Ekşi limon soslu ızgara tavuk,دجاج مشوي مع صلصة الليمون الحامضة,तीखे नींबू के स्वाद के साथ ग्रिल्ड चिकन,Poulet grillé avec glaçage acidulé au citron,Pollo alla griglia con glassa al limone piccante,2025-05-08 14:33:57,2025-05-08 14:33:57
cat-11-toyuq-yem-kl-ri--1-qaymaqli-pendi-rli--toyuq,Creamy Cheese Chicken ,,cat-11-toyuq-yem-kl-ri-,Chicken Dishes,20.5,1,/spinner.svg,0,15,Creamy Cheese Chicken ,Qaymaqlı Pendirli Toyuq,Курица в сливочном сыре,Kremalı Peynirli Tavuk,دجاج بالجبن الكريمي,मलाईदार पनीर चिकन,Poulet au fromage crémeux,Pollo al formaggio cremoso,Chicken breast in rich cheese sauce,Zəngin pendir sousunda toyuq göğsü,Куриная грудка в густом сырном соусе,Zengin peynir soslu tavuk göğsü,صدر دجاج في صلصة الجبن الغنية,पनीर सॉस में चिकन ब्रेस्ट,Poitrine de poulet dans une riche sauce au fromage,Petto di pollo in salsa ricca di formaggio,2025-05-08 14:33:57,2025-05-08 14:33:57
cat-11-toyuq-yem-kl-ri--5-thai-chicken,Thai Chicken ,,cat-11-toyuq-yem-kl-ri-,Chicken Dishes,18,1,/spinner.svg,0,15,Thai Chicken ,Thai Toyuq,Тайская курица,Tayland usulü tavuk,دجاج تايلاندي,थाई चिकन,Poulet thaï,Pollo tailandese,Spicy Thai-style chicken with coconut,Hindistancevizi ilə ədviyyatlı Tay üslubunda toyuq,Острая курица по-тайски с кокосом,Hindistan cevizli baharatlı Tayland usulü tavuk,دجاج حار على الطريقة التايلاندية مع جوز الهند,नारियल के साथ मसालेदार थाई शैली चिकन,Poulet épicé à la thaïlandaise à la noix de coco,Pollo piccante in stile thailandese con cocco,2025-05-08 14:33:57,2025-05-08 14:33:57
cat-11-toyuq-yem-kl-ri--3-toyuq-i-zqara,Grilled Chicken ,,cat-11-toyuq-yem-kl-ri-,Chicken Dishes,18,1,/spinner.svg,0,15,Grilled Chicken ,İzqara Toyuq,Курица на гриле,Izgara tavuk,دجاج مشوي,ग्रिल्ड चिकन ,Poulet grillé,Pollo alla griglia,Simply grilled chicken with herbs,Otlar ilə sadəcə ızgara toyuq,Просто жареная курица с травами,Otlu sade ızgara tavuk,دجاج مشوي مع الأعشاب,जड़ी-बूटियों के साथ सरलता से ग्रिल्ड चिकन,Poulet simplement grillé aux herbes,Pollo alla griglia con erbe aromatiche,2025-05-08 14:33:57,2025-05-08 14:33:57
cat-10-i-sti--q-lyanaltilar-4-assorti--q-lyanalti,Mixed Appetizer Platter ,,cat-10-i-sti--q-lyanaltilar,Hot Appetizers,19,1,/spinner.svg,0,15,Mixed Appetizer Platter ,Qarışıq Qəlyanaltı,Ассорти из закусок,Karışık Meze Tabağı,طبق مقبلات مشكلة,मिश्रित ऐपेटाइज़र प्लैटर,Plateau d'amuse-gueules mixtes,Piatto di antipasti misti,Variety of small plates for sharing,Paylaşmaq üçün müxtəlif kiçik boşqablar,Разнообразие небольших тарелок для совместного использования,Paylaşmak için çeşitli küçük tabaklar,مجموعة متنوعة من الأطباق الصغيرة للمشاركة,साझा करने के लिए विभिन्न प्रकार की छोटी प्लेटें,Variété de petites assiettes à partager,Varietà di piccoli piatti da condividere,2025-05-08 14:33:57,2025-05-08 14:33:57
cat-10-i-sti--q-lyanaltilar-5-krevetl-r-klyarda,Prawns In Batter ,,cat-10-i-sti--q-lyanaltilar,Hot Appetizers,19.5,1,/spinner.svg,0,15,Prawns In Batter ,Klyarda Krevetkalar,Креветки в кляре,Hamurlu Karides,روبيان في العجين,बैटर में झींगा,Crevettes en pâte,Gamberi in pastella,Crispy battered prawns with dipping sauce,Daldırma sousu ilə xırtıldayan xırtıldayan karideslər,Хрустящие креветки в кляре с соусом для макания,Daldırma soslu çıtır çıtır karidesler,روبيان مقرمش مع صلصة الغمس,डिपिंग सॉस के साथ कुरकुरे बैटर वाले झींगे,Crevettes panées croustillantes avec sauce à tremper,Gamberi croccanti in pastella con salsa,2025-05-08 14:33:57,2025-05-08 14:33:57
cat-10-i-sti--q-lyanaltilar-1-pendi-r--ubuqlari,Cheese Sticks ,,cat-10-i-sti--q-lyanaltilar,Hot Appetizers,14,1,/spinner.svg,0,15,Cheese Sticks ,Pendir Çubukları,Сырные палочки,Peynir çubukları,أصابع الجبن,चीज़ चिपकता है ,Bâtonnets de fromage,Bastoncini di formaggio,Golden fried mozzarella with marinara,Marinara ilə qızılı qızardılmış mozzarella,Золотистая жареная моцарелла с маринарой,Marinara soslu kızarmış mozzarella,جبنة موزاريلا مقلية ذهبية اللون مع صلصة مارينارا,मारिनारा के साथ सुनहरा तला हुआ मोत्ज़ारेला,Mozzarella frite dorée avec sauce marinara,Mozzarella fritta dorata con marinara,2025-05-08 14:33:57,2025-05-08 14:33:57
cat-10-i-sti--q-lyanaltilar-2-qizardilmi--so-an-halqalari,Fried Onion Rings ,,cat-10-i-sti--q-lyanaltilar,Hot Appetizers,15,1,/spinner.svg,0,15,Fried Onion Rings ,Qızardılmış Soğan Halqaları,Жареные луковые кольца,Kızarmış Soğan Halkaları,حلقات البصل المقلية,तले हुए प्याज के छल्ले,Rondelles d'oignon frites,Anelli di cipolla fritti,Crispy beer-battered onion rings,Xırtıldayan pivə ilə döyülmüş soğan halqaları,Хрустящие луковые кольца в пивном кляре,Çıtır bira hamurlu soğan halkaları,حلقات البصل المقرمشة المغطاة بالبيرة,कुरकुरे बियर-बैटर प्याज के छल्ले,Rondelles d'oignon croustillantes panées à la bière,Anelli di cipolla croccanti in pastella di birra,2025-05-08 14:33:57,2025-05-08 14:33:57
cat-10-i-sti--q-lyanaltilar-3-toyuq-naggetsl-ri-,Chicken Nuggets ,,cat-10-i-sti--q-lyanaltilar,Hot Appetizers,14,1,/spinner.svg,0,15,Chicken Nuggets ,Toyuq Nuggetləri,Куриные наггетсы,Tavuk nugget'ları,قطع دجاج ناجتس,चिकन नगेट्स,Nuggets de poulet,Nuggets di pollo,Tender chicken pieces in crispy coating,Xırtıldayan örtükdə yumşaq toyuq parçaları,Нежные кусочки курицы в хрустящей панировке,Çıtır kaplamalı yumuşak tavuk parçaları,قطع دجاج طرية مغطاة بطبقة مقرمشة,कुरकुरी कोटिंग में चिकन के मुलायम टुकड़े,Morceaux de poulet tendres enrobés d'une panure croustillante,Teneri pezzi di pollo in una panatura croccante,2025-05-08 14:33:57,2025-05-08 14:33:57
cat-5--orbalar-6-buyabes-d-ni-z-m-hsullari--orbasi,Bouillabaisse Seafood Soup ,,cat-5--orbalar,Soups,18,1,/spinner.svg,0,15,Bouillabaisse Seafood Soup ,Buyabes Dəniz Məhsulları Şorbası,Суп из морепродуктов «буйабес»,Bouillabaisse Deniz Ürünleri Çorbası,شوربة بويابيس للمأكولات البحرية,बोउइलाबेसे समुद्री भोजन सूप,Soupe de fruits de mer à la bouillabaisse,Zuppa di frutti di mare alla bouillabaisse,French-style seafood stew,Fransız üslubunda dəniz məhsulları güveç,Тушеные морепродукты по-французски,Fransız usulü deniz mahsulleri yahnisi,حساء المأكولات البحرية على الطريقة الفرنسية,फ्रेंच शैली का समुद्री भोजन स्टू,Ragoût de fruits de mer à la française,stufato di pesce alla francese,2025-05-08 14:33:57,2025-05-08 14:33:57
cat-5--orbalar-5-d--b-r-,Dumplings ,,cat-5--orbalar,Soups,8.5,1,/spinner.svg,0,15,Dumplings ,Düşbərə,Пельмени,Köfteler,الزلابية,पकौड़े,Boulettes,Gnocchi,Steamed or fried dumplings with filling,İçlik ilə buxarlanmış və ya qızardılmış köftələr,Вареники паровые или жареные с начинкой,İç harcıyla buharda pişirilmiş veya kızartılmış köfte,الزلابية المطهوة على البخار أو المقلية مع الحشوة,"भाप से पकाए गए या तले हुए पकौड़े, जिनमें भरावन हो",Raviolis cuits à la vapeur ou frits avec garniture,Ravioli ripieni al vapore o fritti,2025-05-08 14:33:57,2025-05-08 14:33:57
cat-5--orbalar-4-g-b-l-k--orbasi,Mushroom Soup ,,cat-5--orbalar,Soups,6.9,1,/spinner.svg,0,15,Mushroom Soup ,Göbələk Şorbası,Грибной суп,Mantar Çorbası,حساء الفطر,मशरूम का सूप ,Soupe aux champignons,Zuppa di funghi,Creamy soup with fresh mushrooms,Təzə göbələk ilə qaymaqlı şorba,Крем-суп со свежими грибами,Taze mantarlı kremalı çorba,شوربة كريمة مع الفطر الطازج,ताजे मशरूम के साथ मलाईदार सूप,Soupe crémeuse aux champignons frais,Zuppa cremosa con funghi freschi,2025-05-08 14:33:57,2025-05-08 14:33:57
cat-5--orbalar-3-m-rci---orbasi,Lentil Soup ,,cat-5--orbalar,Soups,6.9,1,/spinner.svg,0,15,Lentil Soup ,Mərci Şorbası,Чечевичный суп,Mercimek Çorbası,شوربة العدس,दाल का सूप,Soupe aux lentilles,Zuppa di lenticchie,Traditional Turkish red lentil soup,Ənənəvi türk qırmızı mərci şorbası,Традиционный турецкий суп из красной чечевицы,Geleneksel Türk kırmızı mercimek çorbası,شوربة العدس الأحمر التركية التقليدية,पारंपरिक तुर्की लाल मसूर सूप,Soupe traditionnelle turque aux lentilles rouges,Zuppa di lenticchie rosse tradizionale turca,2025-05-08 14:33:57,2025-05-08 14:33:57
cat-5--orbalar-2-tomat--orbasi,Tomato Soup ,,cat-5--orbalar,Soups,7.5,1,/spinner.svg,0,15,Tomato Soup ,Tomat Şorbası,Томатный суп,Domates çorbası,شوربة الطماطم,टमाटर का सूप ,Soupe aux tomates,Zuppa di pomodoro,Classic tomato soup with herbs,Otlar ilə klassik pomidor şorbası,Классический томатный суп с травами,Otlu klasik domates çorbası,شوربة الطماطم الكلاسيكية مع الأعشاب,जड़ी-बूटियों के साथ क्लासिक टमाटर सूप,Soupe classique aux tomates et aux herbes,Zuppa di pomodoro classica con erbe aromatiche,2025-05-08 14:33:57,2025-05-08 14:33:57
cat-5--orbalar-1-toyuq--orbasi,Chicken Soup ,,cat-5--orbalar,Soups,6.9,1,/spinner.svg,0,15,Chicken Soup ,Toyuq Şorbası,Куриный суп,Tavuk çorbası,شوربة الدجاج,चिकन सूप ,Soupe au poulet,Zuppa di pollo,Hearty chicken broth with vegetables,Tərəvəz ilə doyurucu toyuq suyu,Наваристый куриный бульон с овощами,Sebzeli doyurucu tavuk suyu,مرق دجاج شهي مع الخضار,सब्जियों के साथ स्वादिष्ट चिकन शोरबा,Bouillon de poulet copieux aux légumes,Brodo di pollo sostanzioso con verdure,2025-05-08 14:33:57,2025-05-08 14:33:57
cat-13--t-yem-kl-ri--3-ciz-biz,Sizzling Beef ,,cat-13--t-yem-kl-ri-,Meat Dishes,19,1,/spinner.svg,0,15,Sizzling Beef ,Cız-bız,Жареная говядина,Cızırtılı dana eti,لحم البقر الساخن,सिज़लिंग बीफ़,Bœuf grésillant,Manzo sfrigolante,Tender beef served on hot iron plate,Yumşaq mal əti isti dəmir boşqabda verilir,"Нежная говядина, подается на горячей чугунной тарелке",Sıcak demir tabakta servis edilen yumuşak dana eti,لحم بقري طري يُقدم على طبق حديدي ساخن,गरम लोहे की प्लेट पर परोसा गया कोमल गोमांस,Bœuf tendre servi sur une plaque de fer chaude,Tenera carne di manzo servita su piastra di ferro calda,2025-05-08 14:33:57,2025-05-08 14:33:57
cat-13--t-yem-kl-ri--2-faxi-tas-can--ti--i-l-,Beef Fajitas ,,cat-13--t-yem-kl-ri-,Meat Dishes,28,1,/spinner.svg,0,15,Beef Fajitas ,Can Əti Faxitas,Фахитас с говядиной,Dana Fajitaları,فاهيتا لحم البقر,बीफ फजिटास,Fajitas au bœuf,Fajitas di manzo,Sizzling beef with peppers and tortillas,Bibər və tortilla ilə qızardılmış mal əti,Жареная говядина с перцем и лепешками,Biber ve tortillalarla cızırtılı dana eti,لحم بقري ساخن مع الفلفل والتورتيلا,मिर्च और टॉर्टिला के साथ गरमागरम बीफ,Bœuf grésillant aux poivrons et tortillas,Manzo sfrigolante con peperoni e tortillas,2025-05-08 14:33:57,2025-05-08 14:33:57
cat-13--t-yem-kl-ri--9-lazanya,Lasagna ,,cat-13--t-yem-kl-ri-,Meat Dishes,19,1,/spinner.svg,0,15,Lasagna ,Lazanya,Лазанья,Lazanya,لازانيا,लज़ान्या,Lasagnes,Lasagna,Layered pasta with meat sauce and cheese,Ət sousu və pendir ilə qatlanmış makaron,Слоеная паста с мясным соусом и сыром,Et soslu ve peynirli katmanlı makarna,معكرونة متعددة الطبقات مع صلصة اللحم والجبن,मांस सॉस और पनीर के साथ स्तरित पास्ता,Pâtes feuilletées avec sauce à la viande et fromage,Pasta a strati con sugo di carne e formaggio,2025-05-08 14:33:57,2025-05-08 14:33:57
cat-13--t-yem-kl-ri--4-nar-qovurma-quzu--ti--i-l-,Pomegranate Stew With Lamb ,,cat-13--t-yem-kl-ri-,Meat Dishes,24,1,/spinner.svg,0,15,Pomegranate Stew With Lamb ,Quzu Əti ilə Nar Qovurma,Гранатовое рагу с ягненком,Kuzu Etli Nar Güveci,يخنة الرمان مع لحم الضأن,मेमने के साथ अनार का स्टू,Ragoût de grenade à l'agneau,Stufato di melograno con agnello,Persian-inspired lamb with pomegranate,Narlı farsca ilhamlanmış quzu əti,Баранина по-персидски с гранатом,Narlı Fars esintili kuzu eti,لحم ضأن مستوحى من المطبخ الفارسي مع الرمان,फ़ारसी-प्रेरित मेमना और अनार,Agneau d'inspiration persane à la grenade,Agnello di ispirazione persiana con melograno,2025-05-08 14:33:57,2025-05-08 14:33:57
cat-13--t-yem-kl-ri--10-qaymaqli-can--ti-,Creamy Beef ,,cat-13--t-yem-kl-ri-,Meat Dishes,33,1,/spinner.svg,0,15,Creamy Beef ,Qaymaqlı Can Əti,Говядина в сливках,Kremalı dana eti,لحم بقري كريمي,मलाईदार बीफ,Bœuf crémeux,Manzo cremoso,Tender beef in rich cream sauce,Zəngin qaymaqlı sousda yumşaq mal əti,Нежная говядина в густом сливочном соусе,Zengin krema soslu yumuşak dana eti,لحم بقري طري في صلصة كريمة غنية,क्रीम सॉस में कोमल गोमांस,Bœuf tendre dans une sauce crémeuse riche,Tenera carne di manzo in salsa cremosa e ricca,2025-05-08 14:33:57,2025-05-08 14:33:57
